{
  "artifact_id": "program:c9f034f8483b824df679f792fec1d0c4d68a0d87e3226a995cd48cc867720683",
  "entry_function": "identity",
  "functions": [
    {
      "body": [
        {
          "kind": "return",
          "value": {
            "kind": "ref",
            "name": "value"
          }
        }
      ],
      "failures": [],
      "id": "identity",
      "parameters": [
        {
          "name": "value",
          "type": {
            "kind": "string"
          }
        }
      ],
      "returns": {
        "kind": "string"
      }
    }
  ],
  "kind": "program",
  "name": "Identity function",
  "schema_version": "0.1.0"
}
